function_id,function,module,roles,priority,trigger,core_result,data_objects,evidence,acceptance_focus,state_exception_permission_rule,source_fc
F-3050,部署地域查询,部署管理,admin,P2,管理员选择部署地域,返回可用部署地域列表,Deployment,controller/deployment.go GetLocations：client.ListLocations、total 为 0 时回退 len(Locations),返回 locations 数组与 total；上游 total=0 时用列表长度兜底,AdminAuth；GetLocations 用普通 Client（非 Enterprise）,FC-099
F-3051,可用副本查询（按硬件 ID + GPU 数）,部署管理,admin,P2,管理员选硬件后查询可用副本,返回指定硬件与 GPU 数下的可用副本,Deployment,controller/deployment.go GetAvailableReplicas：hardware_id 必填、Atoi 校验大于0、gpu_count 默认 1、client.GetAvailableReplicas,hardware_id 缺失返回 hardware_id parameter is required；非法或不大于0 返回 invalid hardware_id parameter；gpu_count 非正回退 1,AdminAuth+EnterpriseClient,FC-099
F-3052,部署价格预估,部署管理,admin,P1,管理员配置部署后预估费用,返回 io.net 价格预估结果,Deployment,controller/deployment.go GetPriceEstimation：ShouldBindJSON(ionet.PriceEstimationRequest)、client.GetPriceEstimation,请求体非法返回绑定错误；成功返回上游 priceResp,AdminAuth；实际计费以 io.net 为准,FC-100
F-3053,集群名称可用性查询,部署管理,admin,P2,管理员输入集群名实时校验,返回该名称是否可用,Deployment,controller/deployment.go CheckClusterNameAvailability：name 查询参数必填、client.CheckClusterNameAvailability、返回 available/name,name 为空返回 name parameter is required；返回 available 布尔与 name,AdminAuth；GET /check-name,FC-100
F-3054,部署容器列表（含容器事件）,部署管理,admin,P2,管理员查看部署下容器,返回容器列表及每容器事件时间线,"Deployment,Container",controller/deployment.go ListDeploymentContainers：ListContainers、Workers 映射 container_id/device_id/uptime_percent/public_url/events,deploymentID 必填；返回 containers 数组含 events(time/message)、total；无容器时返回空数组与 total=0,AdminAuth+EnterpriseClient,FC-100
F-3055,容器详情查询,部署管理,admin,P2,管理员查看单个容器明细,返回容器硬件/状态/事件详情,Container,controller/deployment.go GetContainerDetails：requireDeploymentID 与 requireContainerID、GetContainerDetails、details 为 nil 返回 not found,deploymentID/container_id 任一为空返回对应必填错误；details 为空返回 container details not found；返回 events/public_url/uptime_percent,AdminAuth；双 ID 必填,FC-100
F-3056,容器日志查询（按级别/流/游标分页 + 时间范围）,部署管理,admin,P2,管理员查看容器运行日志,返回容器原始日志（支持过滤与分页）,Container,controller/deployment.go GetDeploymentLogs：container_id 必填、limit 默认 100 上限 1000、level/stream/cursor/follow、start_time/end_time 按 RFC3339 解析,container_id 缺失返回 container_id parameter is required；limit>1000 截断为 1000；非法时间字符串被忽略；follow=true 启用跟随,AdminAuth；GetDeploymentLogs 用普通 Client；时间需 RFC3339,FC-100
F-4001,管理端全量日志查询（按类型/时间/用户名/令牌名/模型/渠道/分组/请求ID过滤分页）,日志与用量,admin,P0,管理员在日志页设置过滤条件翻页,返回符合过滤条件的全量日志分页列表与总数,Log,"controller/log.go GetAllLogs 取 type/start_timestamp/end_timestamp/username/token_name/model_name/channel/group/request_id/upstream_request_id 调 model.GetAllLogs;api-router.go logRoute.GET(""/"") 挂 AdminAuth()",传入 type/时间区间/username 等任一过滤项返回对应子集;total 与 page_size 分页正确;不传 type(LogTypeUnknown=0)返回全部类型,AdminAuth() 中间件保护;普通用户无法访问该接口,FC-101
F-4002,用户自助日志查询（仅本人 user_id，按类型/时间/令牌名/模型/分组过滤）,日志与用量,user,P0,用户在个人日志页翻页查询,返回当前登录用户本人的日志分页列表,Log,"controller/log.go GetUserLogs 取 c.GetInt(""id"") 作 userId 调 model.GetUserLogs;api-router.go logRoute.GET(""/self"") 挂 UserAuth()",返回项均属当前 user_id;无 username/channel 过滤维度(自助接口不暴露);分页 total 正确,UserAuth() 保护;无法越权查询他人 userId 日志,FC-101
F-4003,按令牌明文 key 查询消费日志（令牌读权限 + 限流 + 禁缓存）,日志与用量,user,P1,外部用程序带 token key 调 GET /api/log/token 查该 key 日志,返回该 token_id 对应的日志列表,Log;Token,"controller/log.go GetLogByKey 取 c.GetInt(""token_id"") 调 model.GetLogByTokenId;api-router.go logRoute.GET(""/token"") 挂 TokenAuthReadOnly()+CORS()+CriticalRateLimit()",token_id==0 返回「无效的令牌」;有效 token_id 返回其日志数组;高频调用被 CriticalRateLimit 拦截,TokenAuthReadOnly() 校验 key;Disable/CriticalRateLimit 防滥用,FC-102
F-4004,管理端日志统计（消费类 quota/rpm/tpm 汇总）,日志与用量,admin,P1,管理员在日志页查看统计卡片,返回过滤条件下 LogTypeConsume 日志的 quota、rpm、tpm 三项聚合值,Log,"controller/log.go GetLogsStat 调 model.SumUsedQuota;model/log.go SumUsedQuota Where(""type = ?"", LogTypeConsume)",返回 quota/rpm/tpm 三字段;仅统计 type=2(LogTypeConsume)的记录;过滤项随查询变化,AdminAuth() 保护(logRoute /stat),FC-102
F-4005,用户自助日志统计（按当前用户名汇总 quota/rpm/tpm）,日志与用量,user,P1,用户在个人仪表盘查看用量统计,返回以当前 username 限定的消费日志聚合 quota/rpm/tpm,Log,"controller/log.go GetLogsSelfStat 取 c.GetString(""username"") 传入 model.SumUsedQuota;api-router.go logRoute.GET(""/self/stat"") 挂 UserAuth()",统计 username 固定为当前用户;返回 quota/rpm/tpm;不接受任意 username 参数覆盖,UserAuth() 保护;username 来自上下文不可伪造,FC-102
F-4006,清理历史日志（按目标时间戳分批删除，每批上限 100）,日志与用量,admin,P1,管理员在日志维护设置目标时间点执行清理,删除早于 target_timestamp 的日志并返回删除条数,Log,"controller/log.go DeleteHistoryLogs 校验 target_timestamp!=0 调 model.DeleteOldLog(ctx, targetTimestamp, 100)",target_timestamp 为 0 返回「target timestamp is required」;成功返回 data=删除 count;单次最多删 100 条,AdminAuth() 保护(logRoute DELETE /),FC-101
F-4007,管理端配额按日数据查询（GetAllQuotaDates，可按 username 过滤）,日志与用量,admin,P1,管理员在数据看板选时间区间查看每日配额,返回时间区间内按日聚合的 QuotaData 列表,QuotaData,"controller/usedata.go GetAllQuotaDates 调 model.GetAllQuotaDates(start, end, username);api-router.go dataRoute.GET(""/"") 挂 AdminAuth()",传 username 过滤指定用户;返回按日分组数据;空 username 返回全站,AdminAuth() 保护,FC-103
F-4008,配额数据按用户聚合（GetQuotaDatesByUser，全站用户维度）,日志与用量,admin,P2,管理员查看各用户配额消耗排布,返回时间区间内按用户分组的配额聚合数据,QuotaData,"controller/usedata.go GetQuotaDatesByUser 调 model.GetQuotaDataGroupByUser(start, end);api-router.go dataRoute.GET(""/users"")",返回以用户为维度的聚合;时间区间生效;数据按 user 分组,AdminAuth() 保护,FC-103
F-4009,用户自助配额按日数据（GetUserQuotaDates，时间跨度上限 1 个月）,日志与用量,user,P1,用户在个人用量页选区间查看每日消耗,返回本人时间区间内的每日 QuotaData,QuotaData,"controller/usedata.go GetUserQuotaDates 取 c.GetInt(""id"") 调 model.GetQuotaDataByUserId;校验 endTimestamp-startTimestamp > 2592000",时间跨度超过 2592000 秒(1 月)返回「时间跨度不能超过 1 个月」;仅返回当前 userId 数据,UserAuth() 保护;userId 来自上下文防越权,FC-103
F-4010,模型/用量排行榜快照（公开，按 period 周/月）,日志与用量,anonymous;user,P2,公开页或控制台请求 GET /api/rankings,返回指定 period 的用量排行榜快照,UsedataRanking,"controller/rankings.go GetRankings 调 service.GetRankingsSnapshot(c.DefaultQuery(""period"", ""week""));api-router.go GET(""/rankings"") 挂 HeaderNavModuleAuth(""rankings"")",period 默认 week;非法 period 返回 400 + 错误信息;成功返回排行快照数据,"受 HeaderNavModuleAuth(""""rankings"""") 模块开关控制是否可见",FC-104
F-4011,管理/高危操作审计日志记录（type=LogTypeManage，记录 action+params+操作者+IP）,日志与用量,admin,P0,管理员执行渠道/系统设置/兑换码等资源操作时自动埋点,落库一条含 action、英文渲染 content、操作者身份与 client IP 的审计日志,Log,controller/audit.go recordManageAudit→model.RecordOperationAuditLog;model/log.go RecordOperationAuditLog Type:LogTypeManage(3);auditContentEN 按 auditContentTemplates 渲染,"写入记录 Type=3;content 由 action 模板(如 option.update→""""Updated system setting ${key}"""")渲染;含 admin_id/admin_username/admin_role/auth_method",未登记 action 退回 action 本身;markAuditLogged 避免鉴权链路重复兜底记录,FC-105
F-4012,用户安全敏感操作审计（passkey 绑定/解绑等，无管理员归属）,日志与用量,user,P1,普通用户完成 passkey 注册或删除等安全动作,记录归属该用户、无 admin_info 的安全审计日志,Log,"controller/audit.go recordUserSecurityAudit 调 model.RecordOperationAuditLog(userId, ..., nil, nil);模板含 user.passkey_register/user.passkey_delete","写入记录 adminInfo 为 nil;content 渲染为 """"Registered a passkey""""/""""Deleted a passkey"""";归属操作用户自身 userId",不依赖 AdminAuth/RootAuth 兜底;用户可在自己日志中看到,FC-105
F-4013,登录审计日志记录（type=LogTypeLogin）,日志与用量,user,P1,用户登录成功后系统埋点,落库一条 type=LogTypeLogin 的登录审计日志,Log,model/log.go RecordLoginLog Type:LogTypeLogin(7) 记录 username/content/ip/action/params/extra,写入记录 Type=7;包含登录 username 与 client IP;按 action/params 结构化存储,与消费/管理日志通过 type 字段区分,FC-105
F-4014,渠道亲和缓存用量统计查询,日志与用量,admin,P2,管理员在亲和缓存监控页查看用量,返回 channel_affinity_usage_cache 的统计数据,ChannelAffinityUsageCache,"api-router.go logRoute.GET(""/channel_affinity_usage_cache"") 挂 AdminAuth() 调 controller.GetChannelAffinityUsageCacheStats",返回亲和缓存用量统计;挂在 logRoute 分组下,AdminAuth() 保护,FC-105
F-4015,系统初始化状态查询（GetSetup，未初始化返回 root 是否存在与数据库类型）,运营与运维,anonymous,P0,首次访问站点前端探测是否需进入初始化向导,返回 setup 状态、root_init、database_type,Setup,controller/setup.go GetSetup 读 constant.Setup;未初始化时 setup.RootInit=model.RootUserExists();按 common.UsingMySQL/PostgreSQL/SQLite 填 DatabaseType,已初始化返回 status=true 直接结束;未初始化返回 root_init 与 database_type(mysql/postgres/sqlite),GET /api/setup 匿名可访问,FC-106
F-4016,系统初始化提交（PostSetup，创建 root 账号 + 设置自用/演示模式 + 写 setup 记录）,运营与运维,anonymous,P0,管理员在初始化向导提交用户名密码与模式开关,创建 root 用户、持久化模式开关并标记 constant.Setup=true,User;Setup;Option,controller/setup.go PostSetup 校验 username<=12、password>=8 且两次一致;创建 Role=RoleRootUser、Quota=100000000 用户;写 SelfUseModeEnabled/DemoSiteEnabled 并 Create model.Setup,已初始化返回「系统已经初始化完成」;用户名>12 字符或密码<8 或两次不一致分别报错;成功后 constant.Setup=true,POST /api/setup 带 anonymousRequestBodyLimit;重复初始化被拒,FC-106
F-4017,全站选项列表查询（GetOptions，自动剔除敏感键 + 注入补全倍率元信息）,运营与运维,root,P0,管理员进入系统设置页加载所有配置,返回过滤敏感键后的 option 列表并附加 CompletionRatioMeta,Option,controller/option.go GetOptions 遍历 common.OptionMap 跳过后缀 Token/Secret/Key/secret/api_key 的键;追加 key=CompletionRatioMeta 的 buildCompletionRatioMetaValue 结果,返回项不含任何以 Token/Secret/Key 结尾的敏感键;额外含 CompletionRatioMeta 项,optionRoute 挂 RootAuth();仅 root 可读全站配置,FC-107
F-4018,全站选项更新（UpdateOption，含逐键合法性校验与依赖检查）,运营与运维,root,P0,管理员在系统设置修改单个配置项,校验通过后落库该选项并记录 option.update 审计,Option;Log,"controller/option.go UpdateOption 对 GitHubOAuthEnabled/discord.enabled/oidc.enabled/theme.frontend/GroupRatio/ImageRatio 等分支校验后 model.UpdateOption;末尾 recordManageAudit(""option.update"",{key})",启用 OAuth 但未填 ClientId 报对应「请先填入...」错误;theme.frontend 非 default/classic 报「无效的主题值」;成功后写审计仅记录 key 不记录 value,optionRoute 挂 RootAuth();合规字段 payment_setting.compliance_ 禁止经此接口改;QuotaForInviter 正值需先确认支付合规,FC-107
F-4019,性能统计查询（缓存/内存/磁盘/GC/Goroutine 与监控阈值配置）,运营与运维,root,P1,管理员打开性能监控面板,返回磁盘缓存、内存、磁盘空间、Goroutine 数与监控配置的聚合统计,PerformanceStats,controller/performance.go GetPerformanceStats 组装 CacheStats/MemoryStats(Alloc/Sys/NumGC/NumGoroutine)/DiskCacheInfo/DiskSpaceInfo/PerformanceConfig,返回含 num_goroutine、num_gc、disk_space_info.used_percent 与监控 CPU/内存/磁盘阈值;实时读 runtime.ReadMemStats,performanceRoute 挂 RootAuth();仅 root 可见运维指标,FC-108
F-4020,清理不活跃磁盘缓存（删除 10 分钟以上未使用缓存文件）,运营与运维,root,P2,管理员在性能面板点击清理磁盘缓存,删除超过 10 分钟未使用的磁盘缓存文件,DiskCache,controller/performance.go ClearDiskCache 调 common.CleanupOldDiskCacheFiles(10 * time.Minute),成功返回「不活跃的磁盘缓存已清理」;10 分钟阈值确保进行中请求不被误删,performanceRoute DELETE /disk_cache 挂 RootAuth(),FC-108
F-4021,强制执行 GC / 重置性能统计计数,运营与运维,root,P2,管理员手动触发垃圾回收或重置统计,执行 runtime.GC() 或重置磁盘缓存统计计数,PerformanceStats,controller/performance.go ForceGC 调 runtime.GC() 返回「GC 已执行」;ResetPerformanceStats 调 common.ResetDiskCacheStats() 返回「统计信息已重置」,ForceGC 返回「GC 已执行」;ResetPerformanceStats 返回「统计信息已重置」;两者均为幂等运维动作,performanceRoute POST /gc 与 /reset_stats 挂 RootAuth(),FC-108
F-4022,日志文件列表查询（仅 oneapi-*.log，含总大小与最早/最新时间）,运营与运维,root,P2,管理员在日志文件管理页加载文件列表,返回日志目录下日志文件列表、文件数、总大小、最旧/最新时间,LogFile,controller/performance.go GetLogFiles 调 getLogFiles 仅收 前缀 oneapi- 且后缀 .log 的文件按名降序;LogDir 为空返回 Enabled=false,LogDir 未配置返回 enabled=false;仅列出 oneapi-*.log;返回 file_count/total_size 及 oldest_time/newest_time,performanceRoute GET /logs 挂 RootAuth(),FC-108
F-4023,清理过期日志文件（by_count 保留最新 N 个 / by_days 删早于 N 天，跳过活动日志）,运营与运维,root,P2,管理员选择按数量或天数清理日志文件,删除符合条件的日志文件并返回删除数与释放字节,LogFile,controller/performance.go CleanupLogFiles mode 必须 by_count/by_days;value 须为正整数;跳过 logger.GetCurrentLogPath() 当前活动日志,mode 非 by_count/by_days 报「invalid mode」;value<1 报「invalid value」;当前活动日志不被删除;部分失败返回 failed_files 并 success=false,performanceRoute DELETE /logs 挂 RootAuth();LogDir 未配置报错,FC-108
F-4024,性能指标汇总查询（公开 summary，按 hours + 活动分组聚合）,运营与运维,anonymous;user,P2,公开模型性能页或控制台请求 perf-metrics/summary,返回近 N 小时各活动分组的性能指标汇总,PerfMetric,"controller/perf_metrics.go GetPerfMetricsSummary hours 默认 24;activeGroups=GetGroupRatioCopy 键 + ""auto"" 调 perfmetrics.QuerySummaryAll;api-router.go perfMetricsRoute 挂 HeaderNavModulePublicOrUserAuth(""pricing"")",hours 默认 24 可经 query 覆盖;仅聚合活动分组 + auto;查询失败返回 500 + message,"受 HeaderNavModulePublicOrUserAuth(""""pricing"""") 控制公开或登录可见",FC-109
F-4025,单模型性能指标查询（按 model 必填 + group + hours，过滤非活动分组）,运营与运维,anonymous;user,P2,前端选定某模型查看其性能曲线,返回该模型按分组的性能指标且仅保留活动分组,PerfMetric,"controller/perf_metrics.go GetPerfMetrics model 为空返回 400「model is required」;调 perfmetrics.Query{Model,Group,Hours};result.Groups=filterActiveGroups",model 为空返回 400;返回 Groups 仅含活动分组或 auto;hours 默认 24,perfMetricsRoute GET 受 pricing 模块鉴权,FC-109
F-4026,Uptime-Kuma 状态接入（并发拉取多组状态页 + 心跳，聚合可用率/状态）,运营与运维,anonymous,P2,前端状态页请求 GET /api/uptime/status,返回各监控组的 monitor 列表（名称/可用率/状态/分组）,UptimeMonitor,controller/uptime_kuma.go GetUptimeKumaStatus 读 console_setting.GetUptimeKumaGroups();errgroup 并发拉 /api/status-page/{slug} 与 /heartbeat/{slug};uptimeKeySuffix=_24,未配置 groups 返回空数组;按 monitorID 匹配 uptimeList(_24 后缀)与 heartbeatList;单组拉取失败返回该组空 monitors,GET /api/uptime/status 匿名可访问;httpTimeout 10s / requestTimeout 30s,FC-110
F-4027,用户协议公开内容读取,运营与运维,anonymous,P1,公开协议页加载用户协议正文,返回系统配置的用户协议文本,LegalSetting,controller/misc.go GetUserAgreement 返回 system_setting.GetLegalSettings().UserAgreement,返回 data 为 UserAgreement 文本;未设置时为空字符串,匿名公开可读,FC-111
F-4028,隐私政策公开内容读取,运营与运维,anonymous,P1,公开隐私页加载隐私政策正文,返回系统配置的隐私政策文本,LegalSetting,controller/misc.go GetPrivacyPolicy 返回 system_setting.GetLegalSettings().PrivacyPolicy,返回 data 为 PrivacyPolicy 文本;未设置时为空,匿名公开可读,FC-111
F-4029,公告/关于/首页内容公开读取,运营与运维,anonymous,P2,前端加载公告栏、关于页、首页自定义内容,分别返回 OptionMap 中 Notice/About/HomePageContent 文本,Option,"controller/misc.go GetNotice 返 OptionMap[""Notice""];GetAbout 返 OptionMap[""About""];GetHomePageContent 返 OptionMap[""HomePageContent""]",三接口分别返回对应 OptionMap 键值;读取时持 OptionMapRWMutex.RLock,匿名公开可读;读锁保证并发一致,FC-111
F-4030,支付合规声明确认（仅会话鉴权，写合规版本/时间/操作者/IP）,运营与运维,root,P0,管理员在合规弹窗勾选确认并提交,落库 5 个 payment_setting.compliance_* 选项并返回确认结果,Option,controller/payment_compliance.go ConfirmPaymentCompliance 拒绝 access_token;req.Confirmed 必为 true;写 compliance_confirmed/terms_version/confirmed_at/confirmed_by/confirmed_ip,use_access_token 返回 403「requires dashboard session」;confirmed=false 返回「请确认合规声明」;成功写入 5 项并返回 terms_version/confirmed_by,optionRoute POST /payment_compliance 挂 RootAuth();仅会话(非 API token)可确认,FC-112
F-4031,控制台旧设置迁移（ApiInfo/Announcements/FAQ/UptimeKuma 旧键转 console_setting.*）,运营与运维,root,P2,管理员触发旧配置迁移,将旧 option 键转换为 console_setting.* 新结构并删除旧键,Option,controller/console_migrate.go MigrateConsoleSetting 读 AllOption;ApiInfo/FAQ 截断 50 条转 console_setting.api_info/faq;UptimeKumaUrl+Slug 同时存在才迁为 uptime_kuma_groups;Delete 旧键并 InitOptionMap,ApiInfo/FAQ 超 50 条被截断;仅当 url 与 slug 同时存在才迁移 uptime;旧键 ApiInfo/Announcements/FAQ/UptimeKumaUrl/UptimeKumaSlug 被删并重载 OptionMap,optionRoute POST /migrate_console_setting 挂 RootAuth();标注下个版本删除,FC-113
F-4032,"模型请求限流分组配置（按分组设置 [count,duration] 上限并校验）",运营与运维,root,P1,管理员配置某分组的模型请求速率上限,校验 JSON 后保存分组限流配置,Option,controller/option.go UpdateOption case ModelRequestRateLimitGroup 调 setting.CheckModelRequestRateLimitGroup;setting/rate_limit.go ModelRequestRateLimitGroup map[string][2]int,"非法 JSON 或不合法 [count,duration] 校验失败返回错误;保存后 GetGroupRateLimit 按分组返回限流值",optionRoute 挂 RootAuth(),FC-114
F-4033,敏感词内容过滤配置（启用开关 + 换行分隔词表）,运营与运维,root,P2,管理员在内容安全设置维护敏感词,启用开关与敏感词列表生效于 prompt 检查,SensitiveWords,setting/sensitive.go CheckSensitiveEnabled、CheckSensitiveOnPromptEnabled、SensitiveWords;SensitiveWordsFromString 按换行拆分;ShouldCheckPromptContent=两开关与运算,换行字符串被拆为词表;ShouldCheckPromptContent 在两开关均为 true 时才返回 true;默认含 test_sensitive,经选项接口由 root 配置,FC-115
F-4034,用户可用分组与自动分组配置（auto_group 列表 + 默认启用开关）,运营与运维,root,P1,管理员配置 auto 分组成员与默认是否启用,保存自动分组列表与 DefaultUseAutoGroup 开关,AutoGroup,setting/auto_group.go DefaultUseAutoGroup、UpdateAutoGroupsByJsonString、GetAutoGroups、ContainsAutoGroup;misc.go GetStatus 暴露 default_use_auto_group,ContainsAutoGroup 对 auto 分组返回 true;UpdateAutoGroupsByJsonString 解析 JSON 列表;GetStatus 暴露 default_use_auto_group 给前端,经选项接口由 root 配置,FC-116
F-4035,前端主题切换配置（default / classic 二选一，写入即生效）,运营与运维,root,P1,管理员在系统设置切换前端主题,校验主题值合法后保存 theme.frontend,Option,"controller/option.go UpdateOption case ""theme.frontend"" 仅允许 default/classic;misc.go GetStatus 暴露 theme=system_setting.GetThemeSettings().Frontend",theme.frontend 非 default/classic 返回「无效的主题值，可选值：default（新版前端）、classic（经典前端）」;成功后 GetStatus 返回新 theme,optionRoute 挂 RootAuth();前端依 GetStatus.theme 渲染对应主题,FC-117
F-4036,后端多语言解析与切换（zh-CN/zh-TW/en，按用户设置或 Accept-Language）,运营与运维,user;anonymous,P2,请求进入时按上下文确定响应语言,按用户语言设置或 Accept-Language 头返回对应语言文案,UserSetting,i18n/i18n.go Init 加载 locales/zh-CN.yaml、zh-TW.yaml、en.yaml;GetLangFromContext 先取用户设置再 ParseAcceptLanguage;T/Translate 渲染,已登录用户优先用其 UserSetting 语言;未登录回退 Accept-Language;支持 zh-CN/zh-TW/en,语言来自上下文不可任意伪造;懒加载用户语言,FC-118
F-4037,额度预警通知配置（email/webhook/bark 三渠道 + 预警阈值，正数校验）,运营与运维,user,P1,用户在个人设置选择通知方式并填阈值,保存通知类型、对应渠道参数与额度预警阈值,NotificationSetting,web/classic/.../NotificationSettings.jsx warningType 单选 email/webhook/bark;warningThreshold 必填且校验正数;webhook 填 webhookUrl+webhookSecret(Bearer);bark 填 barkUrl,warningType=webhook 时 webhookUrl 必填;warningThreshold 非正数报「预警阈值必须为正数」;余额低于阈值时按所选渠道发「您的额度即将用尽」通知,webhookSecret 以 Bearer 加请求头校验合法性,FC-119
F-4038,站内对话试用 Playground（临时令牌走 relay，禁用 access token）,Playground,user,P0,用户在 Playground 选模型发起对话提交 POST /pg/chat/completions,以临时令牌构造 relay 上下文并转发对话请求,Token;User,"controller/playground.go Playground 拒绝 use_access_token;GenRelayInfo(RelayFormatOpenAI);构造 tempToken{Name:playground-<group>,Group:UsingGroup} 经 SetupContextForToken 后调 Relay",use_access_token 返回 ErrorCodeAccessDenied「暂不支持使用 access token」;以 playground-<group> 临时令牌按用户分组计费转发,playgroundRouter /pg 挂 UserAuth()+Distribute()+SystemPerformanceCheck();按用户实际额度计费,FC-120
F-4039,营销首页公开状态聚合（系统名/Logo/页脚/登录方式开关/主题/签到开关等）,公开站点,anonymous,P1,访客打开营销首页前端拉取 GetStatus,返回首页渲染所需的全站公开配置聚合,Option;LegalSetting;ConsoleSetting,controller/misc.go GetStatus 返回 system_name/logo/footer_html/各 OAuth 开关/theme/checkin_enabled/user_agreement_enabled 等;镜像证据 WEBSITE-COVERAGE §3 页脚「基于 New API」,返回含 system_name、logo、footer_html、register_enabled、checkin_enabled 等;按 ApiInfoEnabled/AnnouncementsEnabled/FAQEnabled 条件注入可选内容,匿名公开可读;敏感配置不在此暴露,FC-121
